id,title,score,num_comments,author,created_utc,url,over_18,edited,spoiler,stickied
1ccv2r3,Whats your horror story with SAP Integration?,122,74,Ok-Sentence-8542,2024-04-25 15:37:48,https://www.reddit.com/r/dataengineering/comments/1ccv2r3/whats_your_horror_story_with_sap_integration/,False,False,False,False
1ccsf39,The Data Engineering Hype Cycle is beginning (??),116,62,engineer_of-sorts,2024-04-25 13:49:13,https://www.reddit.com/r/dataengineering/comments/1ccsf39/the_data_engineering_hype_cycle_is_beginning/,False,False,False,False
1ccueqx,What is the state of the data orchestration market?,39,17,Similar_Estimate2160,2024-04-25 15:10:50,https://www.reddit.com/r/dataengineering/comments/1ccueqx/what_is_the_state_of_the_data_orchestration_market/,False,False,False,False
1cd0tmv,Easiest and cheapest approach for daily fetch of data,20,21,LouisDeconinck,2024-04-25 19:52:21,https://www.reddit.com/r/dataengineering/comments/1cd0tmv/easiest_and_cheapest_approach_for_daily_fetch_of/,False,False,False,False
1ccsms9,Tips on Dealing with JSON Data,17,21,AMDataLake,2024-04-25 13:58:32,https://www.reddit.com/r/dataengineering/comments/1ccsms9/tips_on_dealing_with_json_data/,False,False,False,False
1cd15m2,How to leverage my Pyspark skills?,17,10,Irachar,2024-04-25 20:04:40,https://www.reddit.com/r/dataengineering/comments/1cd15m2/how_to_leverage_my_pyspark_skills/,False,False,False,False
1ccs3vs,Opensource solution for a tiny data warehouse.,14,35,LeatherPuzzled3855,2024-04-25 13:35:17,https://www.reddit.com/r/dataengineering/comments/1ccs3vs/opensource_solution_for_a_tiny_data_warehouse/,False,False,False,False
1cdc878,Using WSL2 full time,15,11,nydasco,2024-04-26 04:19:20,https://www.reddit.com/r/dataengineering/comments/1cdc878/using_wsl2_full_time/,False,False,False,False
1cdg89d,"is spark a ""boring "" technology?",12,15,Automatic-Law2404,2024-04-26 08:32:09,https://www.reddit.com/r/dataengineering/comments/1cdg89d/is_spark_a_boring_technology/,False,False,False,False
1cd6v3c,Data Engineering Requirements vs. Data Science - Career Decision,9,9,motiontrading,2024-04-25 23:58:18,https://www.reddit.com/r/dataengineering/comments/1cd6v3c/data_engineering_requirements_vs_data_science/,False,False,False,False
1cda190,Sanity Check: Mage,8,6,Lord_Lloydd,2024-04-26 02:25:31,https://www.reddit.com/r/dataengineering/comments/1cda190/sanity_check_mage/,False,False,False,False
1ccy0s6,Implementing a cloud data architecture (Azure) at a small/medium healthcare NPO.,7,13,Special-Salamander10,2024-04-25 18:07:33,https://www.reddit.com/r/dataengineering/comments/1ccy0s6/implementing_a_cloud_data_architecture_azure_at_a/,False,False,False,False
1cd89wr,Data pipeline for a new blogs/ articles notification of Tech blogs,5,0,FriendshipEastern291,2024-04-26 01:02:08,https://www.reddit.com/r/dataengineering/comments/1cd89wr/data_pipeline_for_a_new_blogs_articles/,False,False,False,False
1cd4p69,How do you handle changes upstream to field names that affect your scripts downstream?,3,3,miserablywinning,2024-04-25 22:28:10,https://www.reddit.com/r/dataengineering/comments/1cd4p69/how_do_you_handle_changes_upstream_to_field_names/,False,False,False,False
1cd3xyl,Sync tables from Mysql to any OLAP,5,2,diceHots,2024-04-25 21:52:28,https://www.reddit.com/r/dataengineering/comments/1cd3xyl/sync_tables_from_mysql_to_any_olap/,False,False,False,False
1cd1ce6,Neo4j as a NoSQL database for large data and location data,6,6,__bdude,2024-04-25 20:11:39,https://www.reddit.com/r/dataengineering/comments/1cd1ce6/neo4j_as_a_nosql_database_for_large_data_and/,False,False,False,False
1cdgbjw,Peer Reviews - they actually add more value than you think,6,3,nydasco,2024-04-26 08:38:39,https://medium.com/@nydas/the-underrated-value-of-peer-reviews-in-data-delivery-79092e8040b2?source=friends_link&sk=d53ace6f7b4a962d5491ae4623f3fea8,False,False,False,False
1cd8xbl,Data Catalogue Buy In,6,6,InsightByte,2024-04-26 01:33:07,https://www.reddit.com/r/dataengineering/comments/1cd8xbl/data_catalogue_buy_in/,False,False,False,False
1ccx5yc,Databricks - Lakehouse setup - How to organize Unity Catalog + Medallions and ADLS?,3,3,Allstarbowser,2024-04-25 17:37:46,https://www.reddit.com/r/dataengineering/comments/1ccx5yc/databricks_lakehouse_setup_how_to_organize_unity/,False,False,False,False
1ccrag8,Job expectation vs reality,4,3,JackalTheFulgid,2024-04-25 12:58:43,https://www.reddit.com/r/dataengineering/comments/1ccrag8/job_expectation_vs_reality/,False,False,False,False
1cdha2w,ability to set breakpoints in sql to debug intermediate states of tables?,3,3,cyberjar09,2024-04-26 09:46:25,https://www.reddit.com/r/dataengineering/comments/1cdha2w/ability_to_set_breakpoints_in_sql_to_debug/,False,False,False,False
1cd8sem,Query engine to combine Graph and NoSQL Data,3,2,Hephaestite,2024-04-26 01:26:30,https://www.reddit.com/r/dataengineering/comments/1cd8sem/query_engine_to_combine_graph_and_nosql_data/,False,False,False,False
1cd2hq4,Question regarding relation denormalization ,3,1,xyzb206,2024-04-25 20:54:59,https://www.reddit.com/r/dataengineering/comments/1cd2hq4/question_regarding_relation_denormalization/,False,False,False,False
1cdgi6u,Any good resources to learn about networking/sec/infra as a data engineer painlessly?,2,2,user2401372,2024-04-26 08:51:57,https://www.reddit.com/r/dataengineering/comments/1cdgi6u/any_good_resources_to_learn_about/,False,False,False,False
1cdf4f4,Series UID for images extracted from a Multi-frame DICOM image(video),2,0,Past_Key9901,2024-04-26 07:14:26,https://www.reddit.com/r/dataengineering/comments/1cdf4f4/series_uid_for_images_extracted_from_a_multiframe/,False,False,False,False
1cd4ouc,Cloud Function to trigger Cloud composer DAG,2,0,brittlet,2024-04-25 22:27:48,https://www.reddit.com/r/dataengineering/comments/1cd4ouc/cloud_function_to_trigger_cloud_composer_dag/,False,False,False,False
1cd3saf,Database Access Solution,2,3,sdsmith0610,2024-04-25 21:46:01,https://www.reddit.com/r/dataengineering/comments/1cd3saf/database_access_solution/,False,False,False,False
1cdjiby,"F, Marry, Kill, Befriend; Databricks, Snowflake, Redshift, BigQuery (redo)",2,2,Hot_Map_7868,2024-04-26 11:58:02,https://www.reddit.com/r/dataengineering/comments/1cdjiby/f_marry_kill_befriend_databricks_snowflake/,False,False,False,False
1cd0r1h,I need to optimise my workflow extracting mongo data and uploading it to SQL,1,0,Drogen24,2024-04-25 19:49:38,https://www.reddit.com/r/dataengineering/comments/1cd0r1h/i_need_to_optimise_my_workflow_extracting_mongo/,False,False,False,False
1cczo1s,Extracting information from a Word Document to CSV,1,0,willereid,2024-04-25 19:07:57,https://www.reddit.com/r/dataengineering/comments/1cczo1s/extracting_information_from_a_word_document_to_csv/,False,False,False,False
1ccwob5,Faster Postgres Migrations,1,0,saipeerdb,2024-04-25 16:40:26,https://blog.peerdb.io/how-can-we-make-pgdump-and-pgrestore-5-times-faster,False,False,False,False
1ccv5as,Excited to give you all a  👀 sneak peek demo into Teradata's VantageCloud Lake 🚀,1,0,JanethL,2024-04-25 15:40:39,https://youtu.be/0fsm39quUhY?si=f_urSUxNVXd8x99P,False,False,False,False
1ccqdto,Leveraging NLP in Data Pipelines for Enhanced Insights,1,0,VarshaH_1234,2024-04-25 12:12:59,https://www.reddit.com/r/dataengineering/comments/1ccqdto/leveraging_nlp_in_data_pipelines_for_enhanced/,False,False,False,False
1cd8bs7,Noob learning resources ?,0,1,rantedranter,2024-04-26 01:04:33,https://www.reddit.com/r/dataengineering/comments/1cd8bs7/noob_learning_resources/,False,False,False,False
1cdfiow,Seeking Suggestions: Can I Secure a Job as a Big Data Engineer as a Fresher with No Experience?,0,6,ZenphyriX,2024-04-26 07:42:02,https://www.reddit.com/r/dataengineering/comments/1cdfiow/seeking_suggestions_can_i_secure_a_job_as_a_big/,False,False,False,False
1cdf21y,i am beginner to data engineering i am familiar with python and sql . i am currently under the training my trainer gave the project description . but i don't know what to do next please help me what do i need to do this project.,0,0,Worried-Towel-5886,2024-04-26 07:09:55,https://www.reddit.com/r/dataengineering/comments/1cdf21y/i_am_beginner_to_data_engineering_i_am_familiar/,False,False,False,False
